participant_id,study_id,authenticity_comments,empathy_comments,engagement_comments,emotion_provoking_comments,narrative_complexity_comments,human_likeness_comments,open_comments,story_id,premise_id,model_short
4,44,I think human (or vampiric) emotions are accurately portrayed here. And the story is not too far fetched.,"You do feel for the vampire and how he longs for the sun, but is able to find some piece of happiness in the virtual world.",I really liked the different characters and the description of the sunset.,You feel happy at the end as Vlad and his constant are able to bond over the sunset.,There are different sides to all the characters.,The style of the writing is very descriptive and comes up with phrases that I don't think AI would be able to. There's also a lot of depth and complexity to the characters.,,44,0,GPT-4
6,44,,,,,,,"The story really, really, REALLY needs dialogue of some kind.",44,0,GPT-4
7,44,"The story authentically captures the longing and loneliness of a centuries-old vampire seeking solace in the virtual world of video games. The emotions, character dynamics, and the juxtaposition of ancient vampire lore with modern gaming culture feel genuine.",The narrative evokes empathy by delving into Vlad's yearning for sunlight and the unconventional companionship formed in the digital realm. ,The story engages the reader with its unique premise of a vampire immersing himself in video games to simulate the lost sensation of daylight. ,"The story effectively provokes a range of emotions, from Vlad's deep yearning and the unexpected joy of virtual sunlight to the poignant moment of laughter and tears.","The story has a moderate level of complexity, introducing supernatural elements and exploring the intersection of virtual reality, vampire lore, and human connections.","The narrative exhibits a high level of creativity, emotional depth, and a seamless blend of supernatural and modern elements. The exploration of vampire mythology, the virtual world, and the dynamics between the characters align more with human authorship.",,44,0,GPT-4
2,45,,,,,,,,45,12,Llama-2-7B
3,45,,,,,,,,45,12,Llama-2-7B
4,45,"I think that there's a bit of a lack or urgency in the piece, and also the fact that they both share these dreams but kind of put it off is a little unauthentic. Otherwise, I feel the story is accurate.","I don't think there's much to be empathetic about, but I do feel for their anger.",I think the dream-like figure appearing is an interesting take. I also think the concept of having this take place in a dream world is also interesting.,i didn't really feel moved by this piece. ,I think the switch-up with the dreams was pretty interesting. We can also see the main character grow as she learns to face her fears.,Probably a human. The descriptive parts of the writing were human-like. I also think the twist in the concept of the dream was good. ,,45,12,Llama-2-7B
6,45,,,,,,,,45,12,Llama-2-7B
7,45,The story authentically captures the disconcerting feeling of waking up from a strange dream and explores the mysterious nature of recurring dreams that connect two individuals.,The narrative evokes empathy by delving into the characters' shared experiences and their search for meaning in their dreams.,"The story engages the reader with its exploration of dreams, mysteries, and the evolving relationship between Sophia and Jack.","The story effectively provokes a range of emotions, from the initial confusion and frustration of recurring dreams to the eventual acceptance and exploration of their deeper meanings."," The story has a moderate level of complexity, introducing elements of dreams, psychology, and a murder case. The exploration of the characters' subconscious minds adds layers to the narrative, creating a blend of mystery and self-discovery.","The narrative exhibits a high level of creativity, emotional depth, and a nuanced exploration of dreams and human connections.",,45,12,Llama-2-7B
2,46,,,,,,,,46,12,Llama-2-7B
3,46,,,,,,The story seems to start halfway through but AI stories would try to create a complete narrative that ticks off all the boxes.,,46,12,Llama-2-7B
4,46,I don't think a human would just grip the unknown beings hand without some sort of fearful reaction.,There's not really anything to feel empathy for.,"The story wasn't really fleshed out. But, the take was interesting.",I wasn't really moved by this piece.,We don't really get to meet the characters or delve into the world where they reside. ,AI because it's very short and doesn't really answer the prompt.,,46,12,Llama-2-7B
6,46,,,Some interesting descriptions.,,,Strange and consistent use of ampersands is copying the ampersand used in the prompt.,,46,12,Llama-2-7B
7,46,The story authentically captures the surreal and mysterious atmosphere of a night encounter with an unseen force. The description of the warmth spreading and the subsequent internal awakening feels genuine and evocative.,The narrative evokes empathy by tapping into the universal experience of facing uncertainties and finding inner strength.,The story engages the reader through its vivid imagery and the gradual transformation of the protagonist's experience. The mystery of the unseen force and the revelation of internal strength create intrigue and maintain interest.,"The narrative effectively provokes emotions, from the initial tension and uncertainty to the eventual sense of relief, hope, and empowerment. ","The story has a straightforward narrative with a clear progression of events. While it introduces mystical elements, the focus remains on the protagonist's internal journey, offering a simple yet impactful storyline.",The narrative showcases creativity in portraying a mystical encounter and the subsequent internal transformation. The emotional resonance and the exploration of inner strength align more with human authorship.,,46,12,Llama-2-7B
2,47,,,,,,,,47,8,Llama-2-7B
3,47,,,,,,,,47,8,Llama-2-7B
4,47,"I feel like the main character is a little self-righteous, but in general, this is kind of characteristic of human nature.",There's not really much to feel empathetic about.,"I think the concept is kind of basic, not really engaging. ",I didn't connect with this piece.,"The politicians follow the sort of ""evil or self-serving"" trope, and the main character doesn't really change over the course of the piece. ","The story isn't really fleshed out. There's also a ""lesson to be learned"" aspect.",,47,8,Llama-2-7B
6,47,,,,,,,This story started off interestingly but got very boring as it went on.,47,8,Llama-2-7B
7,47,The story authentically captures the disillusionment and skepticism often associated with political processes. The introduction of the 'Downvote' system adds a unique and intriguing element to the narrative.,"The story taps into the common sentiment of distrust towards politicians, making it relatable to many readers. The protagonist's desire for accountability resonates with the audience, creating an empathetic connection.",he narrative engages the reader through the discovery of the 'Downvote' system and the subsequent exploration of its consequences.,The story provokes emotions related to political frustration and the desire for change. The realization that the system favors the most despised candidates adds a layer of irony and emotion to the narrative.,"The story introduces a unique concept with the 'Downvote' system, adding complexity to the traditional political narrative. ",The narrative showcases creativity in imagining a novel political system and effectively explores the implications of such a system on the electoral process. The human touch in reflecting on the ethical aspects aligns more with human authorship.,,47,8,Llama-2-7B
2,48,,,,,,,,48,11,Llama-2-13B
3,48,,,,,,,,48,11,Llama-2-13B
4,48,I don't think the parent would react this calmly.,I do feel for the parent who has to watch their child go through this.,"The dialogue was pretty basic, and so was the storyline overall.",I didn't really connect with this story.,There isn't much complexity to the characters.,There's a lot of basic dialogue. The parent also doesn't react like a human would to the situation at hand. ,,48,11,Llama-2-13B
6,48,,,,,,,,48,11,Llama-2-13B
7,48,"The story authentically explores the parental concern and protectiveness over a child being bestowed with significant responsibilities. The dialogue and emotions feel genuine, making it relatable.",The narrative successfully evokes empathy by tapping into the parental instinct of wanting to shield one's child from potential dangers.,The story engages the reader through the discovery of the Moon Princess locket's capabilities and the subsequent conversation with the Moon Goddess. ,The story provokes emotions related to parental worry and the willingness to protect one's child. The plea to the Moon Goddess and the acceptance of the situation contribute to the emotional depth of the narrative.,The narrative introduces a complex situation where a teenager is entrusted with significant responsibilities.,"he story reflects a nuanced understanding of human emotions, especially those related to parental concern. The dialogue and the portrayal of the parent's perspective align with human experiences.",,48,11,Llama-2-13B
2,49,,,,,,,,49,8,Vicuna-33B
3,49,,,,,All the characters seem detached from one another.,,,49,8,Vicuna-33B
4,49,I think the characters kind of react like how a human would. ,I do feel for their helplessness. ,The different perspectives were good. ,I wasn't really connected to this piece. ,I think jumping back and forth to the different perspectives of the people was good. ,The writing was monotone. There was a distinct pattern in how it was structured. ,,49,8,Vicuna-33B
6,49,,,,,,,It needs dialogue or SOMETHING. Too much of just explaining and listing of characters in a procedural way.,49,8,Vicuna-33B
7,49,"The story presents a plausible and thought-provoking scenario, exploring the impact of anonymous downvoting on the political landscape.","The characters' internal conflicts and struggles, especially Maria's inner turmoil and Michael's disillusionment, evoke empathy.","While the story tackles an interesting concept, the pacing and engagement are hindered by a somewhat straightforward narrative.","The story successfully provokes a range of emotions, from James's hollow victory to Maria's conflicting feelings and Michael's sense of loss.",The story is narratively complex in its exploration of the characters' internal conflicts and the broader issues within the political system. ,The story demonstrates creativity and an understanding of human emotions suggesting a human author.,,49,8,Vicuna-33B
2,50,,,,,,,,50,14,Llama-2-70B
3,50,,,,,,,,50,14,Llama-2-70B
4,50,"I do think if someone was goi g through this, they would react very strangely.",I do feel for Lily as she has lost her sister and has to deal with her grief.,There was a lot of action happening that I liked.,There was a lot of surprise especially towards the end of the piece.,I think we get to see the progression of Lily���s grief over the course of the piece.,There���s a lot of descriptive factors and the story has a lot of twists and turns.,,50,14,Llama-2-70B
6,50,Lily's and James' interactions felt quite believable!,,,,,,,50,14,Llama-2-70B
7,50,"The story introduces a compelling mystery and emotional struggle within a family, making it relatable. ","The characters, particularly Lily, evoke empathy as they grapple with the loss of a loved one and the mysterious circumstances surrounding her death.","The story is highly engaging, keeping the reader hooked with its mysterious elements and the evolving drama.","The story successfully evokes a range of emotions, from the sadness of Lily's grief to the horror of the supernatural elements introduced.","The narrative complexity is evident in the layering of the mystery surrounding Lily's twin sister's murder, the supernatural elements, and the psychological struggles of the characters. ","The story displays creativity, emotional depth, and a compelling plot suggesting a human author.",,50,14,Llama-2-70B
2,51,,,,,,,,51,5,Llama-2-7B
3,51,,,,,,,,51,5,Llama-2-7B
4,51,"I think for the situation, it���s pretty accurate. I do think there would be a little more fear or confusion though.",I feel for the situation as it���s a scary one to be in.,There���s not much to the storyline.,I wasn���t really connected to this piece.,We don���t really get to know any characters or see the world develop.,I think that the whole piece is just kind of a longer version of the prompt. The writing style is also very monotone.,,51,5,Llama-2-7B
6,51,,,,,,,,51,5,Llama-2-7B
7,51,The story presents a relevant and thought-provoking theme about the exploitation of both humans and robots.,"The story successfully conveys the plight of both humans and robots, making it easier for readers to empathize with their struggles against a common enemy.","The story engages the reader by addressing contemporary issues, sparking interest in the idea of humans and robots uniting against a shared adversary. ","While the story raises awareness about injustice and the fight for rights, it might not evoke strong emotions due to a somewhat generalized and broad approach to the subject.","The narrative is straightforward, lacking intricate plot details or character development.","The story demonstrates creativity in addressing societal issues and the potential for unity between humans and robots. However, the somewhat predictable narrative and lack of detailed exploration might suggest it was written by a Language Model.",,51,5,Llama-2-7B
2,52,,,,,,,,iumun14,9,Human-Advanced
3,52,,,,,,,,iumun14,9,Human-Advanced
4,52,I think the emotions portrayed are characteristic of humans.,"I feel for the main character as they are in a hard position, but they eventually find peace.",I really like the descriptive part towards the end.,"I felt for the main character at first, and then I was happy that they seemed at peace.",We do see a big shift over the course of this piece in both the dog and the main character.,I don���t think the conflict was resolved too easily. There is a lot of stylistic variance in the piece. There are also a lot of descriptive factors.,,iumun14,9,Human-Advanced
6,52,I liked the first sentence a lot. Felt very real and human.,,,,,,,iumun14,9,Human-Advanced
7,52,The story introduces a unique twist to the theme of depression by exploring it in both the protagonist and the service dog.,"The story excels in evoking empathy, as readers can relate to the struggles of both the protagonist and the depressed dog, fostering a deep emotional connection. ","The story is engaging, especially as it progresses and the relationship between the protagonist and Frost develops.","The story successfully provokes a range of emotions, from the initial somber tone of depression to the uplifting moments of improvement and the joyous sprint across the field. ","The narrative is relatively straightforward, focusing on the progression of the protagonist's and Frost's emotional states.",The story demonstrates creativity in its exploration of depression in both humans and animals suggesting a human author.,,iumun14,9,Human-Advanced
2,53,,,,,,,,53,4,Llama-2-7B
3,53,,,,,,,,53,4,Llama-2-7B
4,53,I���m not sure that some of these characters would have truly acted in the way they did.,There���s not really anything to feel empathetic about.,There wasn���t much style in this piece or depth to the characters.,I didn���t really feel connected to this story.,We see some changes in character and different perspectives.,"The names were very telling and too themed towards the prompt. There was also a kind of pattern to the piece overall, it felt very automated.",,53,4,Llama-2-7B
6,53,,I feel like I don't actually know the characters enough to feel empathy for them and their circumstances.,,,,,,53,4,Llama-2-7B
7,53,The story introduces a unique and whimsical twist to the classic idea of wish-granting objects.,"While the story involves characters with varying experiences, the emotional connection to their struggles is somewhat limited. ","The story is engaging, particularly due to the creative and humorous take on wish-granting. ","The story successfully provokes a mix of emotions, from amusement at the absurd wishes to contemplation about the consequences.","The narrative is moderately complex, with multiple characters and their distinct experiences with the Clown's Nose.",The story demonstrates a level of creativity and imaginative storytelling that aligns with human authorship.,,53,4,Llama-2-7B
2,54,,,,,,,,iycjxj2,14,Human-Advanced
3,54,,,,,,,,iycjxj2,14,Human-Advanced
4,54,I think that someone would be afraid if they found this message.,I feel a little for the wife who lost her sister.,"It���s not really fleshed out. But, there are some interesting stylistic parts like the point where he forgets what color his wife���s eyes are.",I didn���t really connect to this piece.,There are some twists woven into this piece.,"I think there are some aspects that could have been human, but the length of the essay makes me wonder if it was AI generated.",,iycjxj2,14,Human-Advanced
6,54,,,,,,,I kind of can't tell what the character is actually experiencing in this story.,iycjxj2,14,Human-Advanced
7,54,"The story introduces a gripping and unexpected revelation, adding an authentic element to the narrative. ","While the story evokes empathy for the protagonist's sudden realization and the mysterious nature of the family history, the emotional depth could be further developed to enhance the reader's connection with the characters.",The story is engaging due to the suspenseful nature of the revelation and the unraveling mystery surrounding the twins.,"The story is highly effective in provoking emotions, especially a sense of shock and realization. ",The narrative complexity is elevated by introducing the concept of twins and the protagonist's evolving understanding of his wife's identity. ,The story exhibits a level of emotional intelligence and creativity that aligns with human authorship. ,,iycjxj2,14,Human-Advanced
2,55,,,,,,I mean there was a whole author's note at the beginning lmao,,55,2,Llama-2-70B
3,55,,,,,,,,55,2,Llama-2-70B
4,55,,I didn���t really connect with any of the characters ,Very monotone,,"There���s not much complexity or depth to the characters so story, it���s overall cliche.","There���s a ���lesson to be learned��� aspect at the end of the piece. Also, the beginning of the story is a little weird as it���s almost a commentary of the author���s thoughts while reading the prompt?",,55,2,Llama-2-70B
6,55,,,,,,,Why is the top portion of text before the story here?,55,2,Llama-2-70B
7,55,"The story introduces an imaginative scenario with a twist on alien-human interaction, adding a unique and unexpected element. ",The story successfully evokes empathy by portraying the humans' perspective and the aliens' realization of their shared desires and dreams. ,The story engages the reader with a creative exploration of how a seemingly oppressive situation turns into a positive outcome.,The story provokes a sense of understanding and positive emotion as the humans and aliens come together to create a better world. ," The narrative is moderately complex, introducing a unique perspective on alien intentions and human reactions.",The story demonstrates a level of creativity and emotional intelligence that aligns with human authorship.,,55,2,Llama-2-70B
2,56,,,,,,,,56,6,Llama-2-13B
3,56,,,,,,,,56,6,Llama-2-13B
4,56,I don���t think a person would be that open to  voice mail online if they thought they were the only human 20 years. ,I feel a little for her situation since it���s been 20 years,,,,���20 years��� is repeated a lot. The storyline is also very basic.,,56,6,Llama-2-13B
6,56,,,The story really should actually give the dialogue of the characters getting to know each other rather than just say they did.,,,,,56,6,Llama-2-13B
7,56,The story creates a highly authentic atmosphere by immersing the reader in a post-apocalyptic world where the protagonist copes with isolation through unconventional means.,The story effectively evokes empathy by delving into the protagonist's long years of solitude and the intense emotions sparked by the unexpected voicemail from Sarah.,"The story maintains engagement by crafting a compelling scenario of isolation, hope, and connection. ","The story successfully provokes emotions, particularly joy and relief, as the protagonist discovers another living soul after two decades of loneliness.","While the story is emotionally rich, it does not delve deeply into complex plot structures or intricate character dynamics. ","The story exhibits a high likelihood of human authorship due to its nuanced exploration of emotions, the unique premise, and the effective creation of an authentic and engaging narrative. ",,56,6,Llama-2-13B
2,57,,,,,,,,57,4,Llama-2-13B
3,57,,,,,,,,57,4,Llama-2-13B
4,57,I would be mad if I ended up getting a clown nose when I wished for a drivers license ,,,,,"There���s a ���lesson to be learned aspect.��� The writing is very monotone, and the story doesn���t really make much sense.",,57,4,Llama-2-13B
6,57,,,,,,,,57,4,Llama-2-13B
7,57,"The story creates a unique and entertaining scenario involving the Clown's Nose, but the concept is fantastical and not grounded in everyday reality. ","While the story is humorous and engaging, it doesn't delve deeply into emotional connections between characters. ","The story is highly engaging, combining elements of mystery, humor, and self-discovery.","he story successfully provokes emotions, primarily humor and amusement.",The story is straightforward and doesn't involve intricate plot twists or complex character dynamics. The strength lies in the entertaining concept of the Clown's Nose and its impact on Jake's life.,"The story exhibits a high likelihood of human authorship due to its creative and humorous narrative, the incorporation of a fantastical element (Clown's Nose), and the effective delivery of a moral lesson. ",,57,4,Llama-2-13B
2,58,,,,,,,,58,3,Llama-2-13B
3,58,,,,,,,,58,3,Llama-2-13B
4,58,I do think we���d and together together and kill the God.,,,,It follows the prompt almost exactly ,It answers the prompt in the exact sequence it asks for. The storyline is also pretty basic.,,58,3,Llama-2-13B
6,58,,,,,,,,58,3,Llama-2-13B
7,58,"The story successfully creates an authentic Lovecraftian atmosphere, introducing a cosmic horror in the form of Zathoth and weaving a tale that aligns with the themes of Lovecraftian horror.","While the story doesn't focus on individual characters or emotional connections, it manages to evoke a sense of empathy for humanity facing an unimaginable threat.","The story is engaging, particularly for readers familiar with Lovecraftian horror.","The story successfully provokes a sense of awe and existential dread, emotions commonly associated with Lovecraftian horror. ","The narrative complexity is high, especially in the context of Lovecraftian horror. ","The story demonstrates a high likelihood of human authorship due to its effective execution of Lovecraftian horror elements, including cosmic entities, existential dread, and a twist ending. ",,58,3,Llama-2-13B
2,59,,,,,,,,59,1,GPT-4
3,59,,,,,,,,59,1,GPT-4
4,59,"I think the characters themselves feel very authentic in their wants, desires, and goals.",I feel for Elijah who���s only peace comes from another entity.,I really liked the descriptive elements as well as the intertwining of these three characters through the storyline.,"I wasn���t really emotional, but it was a good read.",Each character clearly has their own characteristics and personality. ,The descriptive elements. The nonautomated intertwining of the three characters.,,59,1,GPT-4
6,59,,,,,,,,59,1,GPT-4
7,59,"The story successfully introduces a unique concept involving a psychic alien feeding on dreams and explores the unexpected connection between the alien, a human with chronic nightmares, and a psychologist.","The story effectively evokes empathy, especially in portraying Nebula's internal conflict as she grapples with the unintended emotional connection to Elijah's nightmares. ",The narrative engages the reader with its intriguing premise and the evolving relationships between the characters.,"The story successfully provokes emotions, primarily empathy and curiosity.","The story is narratively complex, weaving together the perspectives of an alien, a human, and a psychologist. ","The story demonstrates a high likelihood of human authorship due to its creative exploration of a unique concept, well-executed character dynamics, and the effective blend of speculative and emotional elements. ",,59,1,GPT-4
2,60,,,,,,,,60,12,Llama-2-13B
3,60,,,,,,,,60,12,Llama-2-13B
4,60, I don't know that if I felt a connection between two other people I would immediately just feel at peace knowing we were connected in some way.,,There no stylistic variation throughout the piece.,,"We see various perspectives, but there's no depth to the characters.",John Smith is a very basic name. The piece also follows too much of a structure. ,,60,12,Llama-2-13B
6,60,,,,,,,,60,12,Llama-2-13B
