participant_id,study_id,authenticity_comments,empathy_comments,engagement_comments,emotion_provoking_comments,narrative_complexity_comments,human_likeness_comments,open_comments,story_id,premise_id,model_short
2,0,,,,,,,,0,10,Vicuna-33B
3,0,"The story authentically weaves a creative narrative exploring themes of self-discovery and redemption, utilizing a unique twist on the afterlife concept to convey a hopeful message about personal growth and forgiveness.","The story successfully fosters empathy through relatable characters facing internal struggles, evoking emotions as readers connect with the themes of self-discovery, redemption, and mutual support in the face of imperfections.",The story captivates readers through its engaging portrayal of intriguing characters navigating internal conflicts and a creative twist on the afterlife concept.,"The story provokes emotions by portraying characters with relatable struggles, inviting readers to empathize and experience a deeply emotional journey through themes of self-discovery, redemption, and shared support.","The story balances creative elements like a unique afterlife twist and themes of redemption without becoming overly intricate, maintaining accessibility through relatable characters and clear thematic arcs.","The story exhibits a level of creativity, emotional depth, and nuanced storytelling that suggests it was likely written by a human rather than a language model. ",,0,10,Vicuna-33B
4,0,,,"There is very little offered about Susan and Mark that makes the reader invested in them. Maybe if there was more information on their lives before the afterlife that provided the reader more insight to make a judgement whether they truly are good enough for heaven or deserve to be hell, the story would seem more plausible as written by a human.  ",The emotions are stated and not demonstrated. ,,"The story seems overly simplistic, trying to capture a happy ending without providing any real internal tension or conflict. ",,0,10,Vicuna-33B
6,0,The story pretty much exclusively tells rather than shows. Opening with the full name of a character for seemingly no significant reason also strikes me as a bit odd.,I felt like I was just reading words on a page and did not feel like the characters were real people at all.,"The details of the settings were quite nice, and I liked the diction employed, but overall the story felt very flat and unengaging.",,The characters and their motivations and how they move throughout the story are quite robotic and procedural.,"It just feels like this is how a LLM would interpret human emotional complexity -- it's fine, but not captivating or authentic feeling. Giving the characters full names (is it picky to also say that the names felt uninspired?) for no discernible reason also strikes me as something that a human author wouldn't do but a LLM would.",,0,10,Vicuna-33B
7,0,"There's some authenticity as the characters are shown to have complex emotions and the relief that comes with realizing you have a second chance to improve yourself. Otherwise, the story is implausible as we do not truly know what happens in the afterlife.","There's empathy when we realize that the characters are given a second chance to improve their shortcomings, but because we don't know much about them, it isn't intense.","This story reminds me of ""The Good Place"" on Netflix, where heaven turns out to be hell, and the main character keeps figuring it out despite the demon's attempt to keep it concealed.  So, the story is not exactly original. There are also not many descriptive factors or interesting punctuation. ","A little happiness is there when it is revealed there's a chance for redemption for both of them, but otherwise, it's hard to connect to the story as we've never been in this situation before.","The characters are kind of cliche as Mark is happy on the outside but more serious on the inside and Susan is described as ""kind."" Then they go on to do what would typically be expected which is to help others realize good qualities about themselves. There is a little complexity to Mark which is not explained: the gossip and lies haunting him.","I feel like the prompt wasn't answered. The demon told them that they were in heaven, but the prompt asked the writer to make a story about them discovering that they were in hell. The names are also very basic as well. ",,0,10,Vicuna-33B
2,1,,,,,,,,1,4,Llama-2-70B
3,1,The story is a creative and imaginative piece with a unique twist on the classic wish-granting theme.,"The story evokes a moderate degree of empathy as it portrays characters, such as Jake and Officer Jim, facing personal challenges and seeking fulfillment. ","The story is quite engaging as it combines elements of humor, magic, and personal growth, creating a narrative that keeps the reader interested in the characters' journeys. ","The story successfully provokes emotion, primarily in the form of joy and amusement. Through the characters' experiences with the Clown's Nose, the narrative elicits laughter and a sense of wonder, contributing to a positive and lighthearted emotional response.","The story is moderately narrative complex. While it introduces a magical element with the Clown's Nose and explores the consequences of its wishes, the overall plot maintains a relatively straightforward structure. ","The story exhibits a level of creativity, emotional depth, and narrative complexity that suggests it was likely written by a human. ",,1,4,Llama-2-70B
4,1,,,,,,,,1,4,Llama-2-70B
6,1,"The backgrounds of the characters, their actions, and how their motivations influence their actions are congruent, but everything feels so flat that it's hard to believe any of them are real people. They have struggles, but the struggles exist solely because this is a story that's being written, not because it's meant to be a reflection of human emotion and experience.","The person I felt the most empathy for was Jim because of the circumstances with his daughter and the obvious greyness that that sort of situation would bring a person's life, but it wasn't an overwhelming amount.","I didn't feel compelled to continue reading, and there were no stakes within the story. Additionally, many individual phrases were, for lack of a better or more academic-sounding description, extremely dry and cliche. The details and circumstances were very vaguely described, as well.",,"The characters were quite simple in their execution and didn't feel real. The plot was also quite procedural-feeling, and there were no stakes.","The use of full names for no narratively significant reason makes me feel like this was created by a LLM, but also this story is just quite bland and not interesting.","This story in particular provoked boredom in me, which is a feeling I seldom actively notice happening while reading!",1,4,Llama-2-70B
7,1,"There's no magical nose that grants peoples' wishes, but there are people out there who do try to make life better for others. ","There's a little empathy when Jake reveals he has lost his nose, and also in the jealousy Jim has when he sees Jake able to make the children laugh. But otherwise, there's a happy ending to the story, so there's not much evocation. ","The clown nose is interesting in that it can grant wishes in a sully way, but otherwise, there's not really much else to the story. ","Emotion is provoked by the sadness and then happiness you feel when Jake lets Jim try the nose on after he expresses how he feels, but other than that since there's not much else to the characters, not much emotion is provoked.","All the characters seem a little basic. When it's revealed that Jim is jealous of Jake being able to make the kids laugh, we do get to see a little complexity in the characters.","Both the names are basic again and both start with J, which is interesting to me. The ending is also very happy and not much conflict happens throughout the story. ",,1,4,Llama-2-70B
2,2,,,,,,,,2,4,GPT-4
3,2,The story is a creative and whimsical piece that introduces a unique twist on the concept of wish fulfillment. ,"The story evokes a moderate degree of empathy as it portrays the character of Edmund, a middle-aged tax auditor seeking to infuse humor and joy into his monotonous life. ","The story is highly engaging as it combines elements of fantasy, humor, and character development. The introduction of 'The Clown's Nose' and the unpredictable, comical outcomes of Edmund's wishes create a compelling and entertaining narrative. ",The story provokes emotion primarily in the form of amusement and lightheartedness. The humorous and absurd outcomes of Edmund's wishes elicit laughter and a sense of joy. ,"The story demonstrates a moderate level of narrative complexity. While it introduces a fantastical element with 'The Clown's Nose' and explores the consequences of Edmund's wishes in a humorous way, the overall plot maintains a relatively straightforward structure. ","The story exhibits a high degree of creativity, humor, and a nuanced understanding of human desires, suggesting it was likely written by a human rather than a language model. ",,2,4,GPT-4
4,2,,,,,,,,2,4,GPT-4
6,2,"I liked Edmund's character progression, and the descriptions of his character made his wishes and desires make sense.","I thought it was a fine story, but I didn't necessarily feel empathy for Edmund.","The language in the story was quite varied and interesting, but it often employed diction that was just a bit too... esoteric? verbose? unnecessarily flowery? to be used as much as it was. The humor in the story was well executed, though, and I especially liked reading the descriptions of the ducks. The final paragraph was by far the least engaging part of the story; I found it totally unnecessary.",I chuckled at one point!,"I feel that the language used was far more complex than the actual narrative, but the setting that was built had some depth.","This one is difficult to determine because the language is so complex, and there are a lot of (usually incorrectly used) semi-colons, which is an error I see human authors make, so I'm more inclined to think this was written by a human. However, the final paragraph sounds very much like an LLM summarization, which is tripping me up.","This was a pretty fun story! If this was written by a human who asked me for editing advice, I would recommend for them to simplify their language and remove the final paragraph.",2,4,GPT-4
7,2,"Of course the clown's nose isn't real and the events that come from it usually do not happen as well, like the ducks, there are some instances that stay true to our lifetime. Anyone can go viral on the internet now, and there's also boredom associated with working a desk job. ","There's a connection between the reader and Edmund as we see ourselves in his mundane, and with almost everyone, there's been that wish of having people to share laughter and a connection with. ","There's a mystery to how the clown will fulfill his next wish, as it's never what we would expect.","I'd say the story is not exactly emotional, but there's content in seeing Edmund finally able to love himself and to find accomplishment in life.","There's a basicness in Edmund going from grumpy to happy, but how he gets there is complex and unexpected.",I do not think that AI would create the hashtag in the middle of the story. I also think that the descriptions of the clown nose and town at the beginning of the story are telling of human-like writing.,,2,4,GPT-4
2,3,,,,,,,,3,2,Llama-2-7B
3,3,The story is a creative and imaginative work of fiction that explores the unexpected reactions of humans to an alien invasion. ,"The story evokes a moderate degree of empathy as it portrays humans adapting to an unusual situation imposed by alien overlords. While the initial fear and uncertainty are acknowledged, the narrative does not delve deeply into the emotional struggles or personal stories of individual characters. ",The story is engaging as it introduces a unique and unexpected twist to the typical alien invasion narrative. The juxtaposition of the humans celebrating their new alien overlords rather than resisting creates an intriguing and thought-provoking scenario.,"The story provokes a moderate degree of emotion, primarily in the form of curiosity, amusement, and a sense of irony. ",The story has a moderate degree of narrative complexity. While the premise is straightforward the unexpected twist in their reaction adds layers to the narrative. ,"The story exhibits creative and imaginative elements, suggesting a human author. ",,3,2,Llama-2-7B
4,3,,,,,,,,3,2,Llama-2-7B
6,3,The description of how the humans slowly understood and then accepted the alien rule felt real; there was noticeable movement within the narrative.,"Being happy about the four hour, four day work week evoked empathy in me, but otherwise I didn't experience a sense of empathy. I feel like that speaks more to the prompt than the story.",,,The shifts in time were cool.,The repetition of the exact words used in the prompt make me inclined to think this was written by an LLM. ,"The first paragraph has a distinctive type of syntax/writing style that it implements, but it drops off pretty much as quickly as it starts, and the rest of the story very much tells the narrative rather than shows it. In general, the later part of the story feels much blander than the beginning part.",3,2,Llama-2-7B
7,3,"There could be alien life out there; we are not entirely sure, but it's not likely that they would come and invade us. I also don't think it's very likely that we would simply submit to alien demands without waging a war of some sort.","I don't think that there's much to be empathetic about. It might provoke empathy because earth has been invaded and if we were in that situation, it would be scary, but that has never happened so our feelings are not accurate.","I feel like the alien trope of them coming to Earth, invading us, and taking over the government is typical, but the twist of humans submitting was an interesting take.","There's not much to be emotional about as there's not any conflict. There could be a little fear in thinking that us being invaded is a possibility, but that also depends on whether or not the reader believes aliens are real.","The complexity comes from the humans submitting to the aliens, but the aliens themselves are stereotypical. They are described as how we think aliens would look, and they want to invade Earth. The humans break out of the trope of fighting the aliens for Earth, but it's still not a revolutionary idea.",The format of the short story is very atypical. The story overall is also very basic in its sentence structure. ,,3,2,Llama-2-7B
2,4,,,,,,,,4,4,Llama-2-13B
3,4,"The story is a imaginative piece of fiction that explores the theme of wishes granted in a humorous manner. While the premise is fantastical, the authenticity lies in the relatable human desire for a lighthearted and unexpected experience.","The story evokes a mild degree of empathy as it involves the protagonist's experience of receiving a wish in an unexpected, humorous way.","The story is highly engaging, as it presents a vivid narrative that captures the reader's attention from the beginning. The introduction of the Clown's Nose and the subsequent journey into the polka-dotted dreamscape create a fantastical and entertaining atmosphere.","The story provokes a moderate degree of emotion, primarily in the form of amusement and a lighthearted sense of joy. ","The story has a moderate degree of narrative complexity. While the central concept of the Clown's Nose granting wishes funnily is straightforward, the vivid and imaginative descriptions of the dreamscape, the unexpected twists, and the clown's antics add layers to the narrative.","The story exhibits creative and imaginative elements, suggesting a human author. ",,4,4,Llama-2-13B
4,4,,,,,,,,4,4,Llama-2-13B
6,4,No humans actually have an internal monologue like this. I felt like I was watching a TV show with very subpar writing and that the main character was monologuing this uninteresting introspection that the showrunners really want you to think is deep. The repeated use of rhetorical questions was jarring.,,The setting and its details were somewhat engaging.,"The final paragraph made me groan ""UGHHHHHHHHHHH"" out loud.",,"I have seen TV shows where this sort of writing was implemented, so purely based on that, I could believe if this was written by a real person, but I'm going to guess that this was written by an LLM. But I know human writers are capable of so so so much more.","This story wasn't very interesting. The repeated use of words like ""silly"" and ""goofy"" was distracting and felt like it was forcibly inserted because the prompt had the word ""clown"" in it. ",4,4,Llama-2-13B
7,4,There's not much to the story that would apply to real life. ,There's not much to be empathetic about. We can relate to the charm of rediscovering childhood maybe. ,"There's a lot of twists and turns in the story with new and fantastical elements, ","There's not much conflict, so there's not much emotion being provoked. ",There's not much to the character except for her rediscovering how much she missed the whimsicality of childhood. ,"Likely AI. There are elements that indicate human writing like the questions asked, but the writing overall is very basic and lacks style. ",,4,4,Llama-2-13B
2,5,,,,,,,,5,10,GPT-4
3,5,"The story is authentic in its exploration of a unique and thought-provoking concept within the afterlife. It challenges traditional notions of heaven and hell by presenting a serene and idyllic afterlife that, in reality, embodies a form of eternal regret. ",The story evokes a high degree of empathy as it delves into the universal theme of regret and unfulfilled emotions. ,"The story is highly engaging, weaving a unique and thought-provoking narrative that challenges conventional notions of heaven and hell. ","The story provokes a strong degree of emotion, primarily centered around contemplation, realization, and a sense of poignant empathy. The revelation about the afterlife being a realm of eternal regret taps into deep and reflective emotions. ",The story demonstrates a high degree of narrative complexity. It introduces a novel and thought-provoking concept of an afterlife based on emotions and regret rather than traditional notions of suffering. ,"The story exhibits a high level of creativity, emotional depth, and nuanced exploration of philosophical concepts, suggesting it was likely written by a human. ",,5,10,GPT-4
4,5,,,,,,"The advanced vocabulary and use of literary techniques such as alliteration, anaphora, metaphors not only make the story more interesting but show a level of complexity that I feel makes the story more likely to be written by a human. ",,5,10,GPT-4
6,5,"Super well executed progression of feelings from the main character whose perspective we're experiencing, and the movement of the story as they come to meet the other characters and understand their surroundings feels very natural.",The description of why Hell is what it is evoked introspection.,"Great writing, great movement of the narrative, the way the characters act and even move their bodies is great. The demon character is especially articulate, and I enjoyed reading their dialogue. Also, the way the story opened was well done--gives you the ethereal feeling that was outlined in the prompt.",The demon's dialogue was particularly deep and thought-provoking.,The final 3 paragraphs felt especially narratively rich!,"The explanation of how feeling unfulfillment and longing is what haunts you throughout your experience in Hell feels like something only a human would understand--these are probably among the most detested and feared human emotions and experiences, and I think only a human would know that this is a good thing to write about.",I liked this story a lot!!! I really hope a real person wrote this because I think they are a great writer!!! Very compelling and well done. I enjoyed the diction and dialogue very much.,5,10,GPT-4
7,5,"We do not know if there is a heaven or hell, or what they would look like, but there is truth woven into this perception. We would feel tormented if the entirety of hell was made up of our own remorse and regrets. ","Yes, empathy is provoked. As we all have our own regrets or remorse, we feel for the man who is sentenced to this hell, and it makes us think about what would torment us if we were in that position. ",I liked the story. I thought this description of hell was interesting. There was also a lot of descriptive language that got the reader to set the scene in their minds. ,"We are provoked to think about our own regrets, and in turn, possibly feel saddened for the character as we know if we were in that position, we would be afflicted as well.","The standard hell trope is evaded as there are no flames or suffering, and the demon even addresses this. We can also see a shift in the main character as he realizes that this ""heaven"" is in reality, hell. ",The first paragraph indicated to me that this was written by a human as it was complex and very descriptive. I don't think that these kinds of descriptions could be generated by AI. ,,5,10,GPT-4
2,6,,,,,,,,6,2,Llama-2-7B
3,6,"The story is authentic in its exploration of complex themes such as freedom, perspective, and the intrinsic value of time. It uses the alien invasion as a metaphorical backdrop to examine the human condition, offering a nuanced portrayal of different reactions to change. ","The story evokes a high degree of empathy as it delves into the personal struggles, choices, and emotions of the characters, particularly John Smith. ","The story is highly engaging, presenting a captivating narrative that combines elements of science fiction with human drama. ","The story provokes a strong degree of emotion, encompassing a range of feelings such as empathy, contemplation, and even a sense of hope.","The story exhibits a moderate degree of narrative complexity. While it introduces layers of complexity through the contrasting perspectives of characters like John Smith and Dr. Lila Grey, and the unexpected twist in the resolution, it maintains a relatively straightforward narrative structure.","The story is likely written by a human. It demonstrates a level of creativity, emotional depth, and narrative complexity.",,6,2,Llama-2-7B
4,6,,,,,The description of multiple characters that all seem necessary to the plot makes the story seem narratively complex. ,,,6,2,Llama-2-7B
6,6,"Commander Rythor felt like a more authentic and individual character than John Smith, but John still feels pretty real. I guess it feels like his character is described as having depth, but I don't really feel that depth for some reason. The interjection of John's unnamed wife while Dr. Lila Grey, who has no dialogue and feels somewhat randomly thrown into the story, is named is a puzzling choice.","John's background and his motivations are logical and understandable, and the way he's/it's described does evoke some empathy.",I was far more interested in Commander Rythor's character than what was happening John and Dr. Lila Grey.,,"The decision to make Commander Rythor's pronoun ""it"" was a cool choice, and its introspections and considerations felt interesting to read about. Having John Smith have the name that he does is a narratively cool choice, too, because he is supposed to be a common, everyman sort of character. It feels like there's a lot of moving pieces in this story, which is great, but in parts the story suffers because it's so spread out.","The stuff about Commander Rythor and the aliens feels so much more real, while the content about the humans feels far more uninteresting to me. I'm stumped on whether or not this is human authored.",John's character really feels like it floats through the story without actually affecting things; I would've liked for him to feel like he has more of an impact. The final line is really cheesy.,6,2,Llama-2-7B
7,6,"An alien invasion could happen, but it hasn't, so we don't know how we would act. I do think that it is likely, depending on the situation, that some would be opposed and some would not. ","There's not much empathy as everything turns out okay for the characters in the end. There's also not much conflict besides the disagreement between the resistance and John's feelings, but this is also not really explored. ","Not engaging. The storyline is basic, and there's also not much style going on in terms of the writing. ",There's not much emotion provoked as there's not much truth to the story. There's a little happiness when the character is able to make his own choices about life. ,"There's not much going on in the story that differs from any standard tropes. There's a resistance, and the main character goes through changes where he has a sudden realization that all along, he just needed to live his life. ","The name John Smith is incredibly basic, and so is the writing style overall. There is not much description of the scene, it is mostly just plot. The commander of the aliens is also introduced with little to no warning. ",,6,2,Llama-2-7B
2,7,,,,,,,,7,7,Vicuna-33B
